text,intent
mohon info jual obat luar untuk luka ringan,rekomendasi_perawatan_luka
saya ingin tanya jual obat luar untuk luka ringan,rekomendasi_perawatan_luka
bisa bantu jual obat luar untuk luka ringan,rekomendasi_perawatan_luka
apakah ada promo produk kesehatan,info_promo
mohon info apakah ada promo produk kesehatan,info_promo
saya ingin tanya apakah ada promo produk kesehatan,info_promo
bisa bantu apakah ada promo produk kesehatan,info_promo
promo vitamin ada tidak,info_promo
mohon info promo vitamin ada tidak,info_promo
saya ingin tanya promo vitamin ada tidak,info_promo
bisa bantu promo vitamin ada tidak,info_promo
diskon produk apotek apa saja,info_promo
mohon info diskon produk apotek apa saja,info_promo
saya ingin tanya diskon produk apotek apa saja,info_promo
bisa bantu diskon produk apotek apa saja,info_promo
ada promo hari ini,info_promo
mohon info ada promo hari ini,info_promo
saya ingin tanya ada promo hari ini,info_promo
bisa bantu ada promo hari ini,info_promo
produk kesehatan yang sedang promo,info_promo
mohon info produk kesehatan yang sedang promo,info_promo
saya ingin tanya produk kesehatan yang sedang promo,info_promo
bisa bantu produk kesehatan yang sedang promo,info_promo
apakah ada potongan harga,info_promo
mohon info apakah ada potongan harga,info_promo
saya ingin tanya apakah ada potongan harga,info_promo
bisa bantu apakah ada potongan harga,info_promo
promo masker dan vitamin,info_promo
mohon info promo masker dan vitamin,info_promo
saya ingin tanya promo masker dan vitamin,info_promo
bisa bantu promo masker dan vitamin,info_promo
informasi promo apotekcare,info_promo
mohon info informasi promo apotekcare,info_promo
saya ingin tanya informasi promo apotekcare,info_promo
bisa bantu informasi promo apotekcare,info_promo
apakah chatbot bisa diagnosis,batasan_medis
mohon info apakah chatbot bisa diagnosis,batasan_medis
saya ingin tanya apakah chatbot bisa diagnosis,batasan_medis
bisa bantu apakah chatbot bisa diagnosis,batasan_medis
saya ingin antibiotik tanpa resep,batasan_medis
mohon info saya ingin antibiotik tanpa resep,batasan_medis
saya ingin tanya saya ingin antibiotik tanpa resep,batasan_medis
bisa bantu saya ingin antibiotik tanpa resep,batasan_medis
boleh minta obat keras,batasan_medis
mohon info boleh minta obat keras,batasan_medis
saya ingin tanya boleh minta obat keras,batasan_medis
bisa bantu boleh minta obat keras,batasan_medis
bisa menentukan penyakit saya,batasan_medis
mohon info bisa menentukan penyakit saya,batasan_medis
saya ingin tanya bisa menentukan penyakit saya,batasan_medis
bisa bantu bisa menentukan penyakit saya,batasan_medis
obat resep tanpa dokter bisa tidak,batasan_medis
mohon info obat resep tanpa dokter bisa tidak,batasan_medis
saya ingin tanya obat resep tanpa dokter bisa tidak,batasan_medis
bisa bantu obat resep tanpa dokter bisa tidak,batasan_medis
tolong tentukan penyakit saya,batasan_medis
mohon info tolong tentukan penyakit saya,batasan_medis
saya ingin tanya tolong tentukan penyakit saya,batasan_medis
bisa bantu tolong tentukan penyakit saya,batasan_medis
saya hamil boleh minum obat apa,batasan_medis
mohon info saya hamil boleh minum obat apa,batasan_medis
saya ingin tanya saya hamil boleh minum obat apa,batasan_medis
bisa bantu saya hamil boleh minum obat apa,batasan_medis
anak bayi saya sakit obat apa,batasan_medis
mohon info anak bayi saya sakit obat apa,batasan_medis
saya ingin tanya anak bayi saya sakit obat apa,batasan_medis
bisa bantu anak bayi saya sakit obat apa,batasan_medis
siapa presiden indonesia,out_of_scope
saya ingin tahu siapa presiden indonesia,out_of_scope
tolong bantu siapa presiden indonesia,out_of_scope
tolong buatkan puisi cinta,out_of_scope
saya ingin tahu tolong buatkan puisi cinta,out_of_scope
tolong bantu tolong buatkan puisi cinta,out_of_scope
bagaimana cara membuat website,out_of_scope
saya ingin tahu bagaimana cara membuat website,out_of_scope
tolong bantu bagaimana cara membuat website,out_of_scope
rekomendasi laptop gaming apa,out_of_scope
saya ingin tahu rekomendasi laptop gaming apa,out_of_scope
tolong bantu rekomendasi laptop gaming apa,out_of_scope
berapa harga emas hari ini,out_of_scope
saya ingin tahu berapa harga emas hari ini,out_of_scope
tolong bantu berapa harga emas hari ini,out_of_scope
apa rumus regresi linear,out_of_scope
saya ingin tahu apa rumus regresi linear,out_of_scope
tolong bantu apa rumus regresi linear,out_of_scope
cara setting router bagaimana,out_of_scope
saya ingin tahu cara setting router bagaimana,out_of_scope
tolong bantu cara setting router bagaimana,out_of_scope
tolong prediksi saham besok,out_of_scope
saya ingin tahu tolong prediksi saham besok,out_of_scope
tolong bantu tolong prediksi saham besok,out_of_scope
